序号,标签一,标签二,标签三,标题,简介
48,少爷,千金,先婚后爱,《错嫁：少爷的千金又逃了》,霍凛为拒联姻抓乞丐领证，隔天乞丐坐进霍氏董事席："契约第二条——互不干涉。"她甩离婚书时，他正为她挡下家族暗杀。病床他扯开染血绷带："追加条款——乙方需爱甲方。"她签完收购霍氏码头："现在我是你东家。"财经头条爆#霍少码头跪求复婚#，她缆绳勒他脖颈："叫女王就饶命。"
49,少爷,千金,破镜重圆,《藏娇：少爷的落跑千金》,五年前沈未央家族破产，陆司珩亲手送她进疯人院顶罪。五年后地下拍卖场，她戴着面具拍下陆氏祖宅，被他当众扯落面具露锁骨烙痕："这印是为我挡烙铁留的。"她红酒泼他脸："陆少认错人了。"次日法庭她亮证据送他入狱，探监时他咬破指尖在玻璃写血书："疯人院结婚登记处签的字，要重温吗？"狱警突然开门："原告沈小姐，您涉嫌劫囚。"
50,少爷,千金,青梅竹马,《偏宠青梅：少爷的千金甜又野》,顾淮之给邻家千金当十年人形玩具——她骑马他当鞍，放鸢他当线，连初吻都是他当人工呼吸教具。成人礼她挽别人跳伞，顾淮之劫持直升机："我宠坏的野猫轮不到别人驯。"万米高空他锁她腰扣："《驯养指南》终章——饲养员享终身所有权。"她突然夺操纵杆俯冲："可惜今天起，我才是机长。"降落伞包扣他背上："少爷想被我驯吗？"
51,少爷,千金,追妻火葬场,《离婚夜，少爷的玫瑰庄园烧了》,傅云琛为白月光逼唐晚晚流产，手术台她纵火自焚。三年后玫瑰园忌日，他跪刻"亡妻"碑前，却见她挽新欢泼汽油："傅少葬你的朱砂痣够用。"他冲火海举骨灰罐："这里装我们的孩子。"烈焰吞没DNA报告，她夺罐砸碑："加座父子骨灰龛！"财经晨报#傅氏继承人造百万玫瑰墓园#附条款："接受结扎及器官捐赠公证——任取任用。"
52,少爷,公主,先婚后爱,《和亲陷阱：少爷的公主太撩人》,纨绔谢琰为避战娶敌国公主萧璃，新婚夜丢骰子："点数小者睡地板。"她含笑掷出豹子通杀。当他夜袭卧榻，她反扣他手腕媚笑："本宫的地盘，得付过夜费。"次日军营哗变，她披他铠甲镇三军。庆功宴他当众咬她耳坠："付费方式——心肝给你，身子归我。"敌袭号角突响，她扯他领带按上炮台："追加条款——本宫的江山你守。"
53,少爷,公主,破镜重圆,《诈降：少爷的公主带球跑了》,三年前霍凛亲手将和亲公主苏晚晚献给敌酋。三年后战场相逢，她牵着酷似他的男孩点火药库："霍将军，投降还是陪葬？"他当众割袍露腹疤："这刀是你当年剖子留的，还要装仇敌？"男孩突举炸药遥控器："爹地，偷您基因赔十亿合理？"浓烟中她枪指他太阳穴："结扎费另算。"新闻直播手术室，他攥她手按麻醉剂："生三胎够不够？"弹幕刷爆#买爹送妈打八折#
54,少爷,公主,青梅竹马,《娇养守则：少爷的公主太犯规》,陆霆琛给敌国质子当十年人肉沙包——她练箭他举靶，中毒他试药，初恋他代笔情书。归国前夜她吻他眼睫："等我娶你。"三年后她率铁骑破城，将他锁金笼："陆少爷，《质子条约》续约千年。"他扯开衣襟露心口烙印——她幼时刻的"私有物"。朝堂哗变中她劈碎龙椅："现在续约条款改了——女帝的凤榻归你暖。"
55,少爷,公主,追妻火葬场,《坠楼后，少爷给公主当肉垫》,谢琰为白月光逼苏晚晚抽骨髓，天台边她翻身跃下。三年后武林大会，她作为盟主登场，谢琰当众跪伏演武场："请踏我脊背上座。"她剑鞘碾他背脊："谢少当年抽骨髓时可没卑微。"他反手剖出肋骨剑："这里刻着你的名，折断它你就自由。"颁奖时她挑开他衣襟，惊见肋骨拼成"赎"字。江湖快报头版：新盟主收人骨剑为佩，"赎罪永无到期日"。
56,少爷,妹妹,先婚后爱,《替身新娘：少爷的妹妹心太野》,傅沉舟为骗家产娶双胞胎妹妹林晚晚，新婚夜甩契："当好姐姐替身。"她媚笑应允，却在遗嘱宣读日亮DNA报告："真可惜，我才是真千金。"他掐腰按在保险柜："叫夫君就分你一半。"她反手引爆地库："叫主人就留全尸。"火海中他咬她唇："要死一起死。"翌日头条#傅氏废墟拥吻照#配文"灰烬里长出的玫瑰"。
57,少爷,妹妹,破镜重圆,《带崽潜逃：少爷的妹妹掀翻江湖》,七年前江晚晚偷生封枭龙凤胎跑路，七年后萌娃炸了封家赌场。他追到苗疆，缩小版自己递蛊盅："封少，偷您情蛊赔十亿合理？"她银铃轻笑："绝情蛊解药另算。"三日直播解蛊仪式，他攥她手按向心口："中情蛊三生够吗？"竹楼突燃大火，萌娃切江湖令直播："买爹送妈套餐开抢——条件：屠尽封家仇敌！"
58,少爷,妹妹,青梅竹马,《独占青梅：少爷的妹妹甜度满格》,顾衍给捡来的妹妹当十年人形糖罐——她嗜甜他藏糖，蛀牙他当牙医，初吻是喂蜜饯的意外。成人礼她挽别人尝甜品，顾衍当众掀翻餐车："我酿了十年的蜜轮不到别人尝。"酒窖他锁她腕："《家规》补遗——私藏甜食归家主独享。"她突然亮出糖王证书："可惜今日起，我才是掌糖人。"蜜勺抵他喉结："哥哥想被私藏吗？"
59,少爷,妹妹,追妻火葬场,《捐肝手术台，少爷的私人岛屿沉了》,陆司珩为救白月光逼苏晚晚捐肝，手术中接到她孕检单时已摘除。三年后海岛峰会，她作为岛主现身，他驾游艇撞岸："晚晚，我的肝永远是你的。"她引爆炸弹按钮："陆少，过期器官该填海。"私人岛屿沉没时直播画面定格——他怀揣婴儿CT片跃入漩涡："那用骨血养你新岛。"海洋局档案载：新群岛命名"赎罪礁"，礁心嵌钻戒。
60,少爷,夫人,先婚后爱,《隐婚法则：少爷的夫人是黑客》,谢琰为骗信托基金娶书呆子苏晚，新婚夜甩手册："当好空气，别碍眼。"她扶眼镜应允，却在三个月后黑进谢氏系统转空百亿。当被抵在服务器机柜时，她咬他喉结媚笑："少爷，防火墙破了哦。"他撕碎手册："追加条款——漏洞由你填补。"财经频道直播谢氏破产时，她踩他膝盖登录主控台："叫女王就恢复1%数据。"突然警报大作，大屏弹出#谢少穿女仆装求饶#直播："永久条款——身心归属女王陛下。"
61,少爷,夫人,破镜重圆,《假死后，少爷的夫人在修长城》,陆司珩亲手为唐晚晚建衣冠冢，三年后长城修缮直播惊现她挑砖的身影。他冲过脚手架抓住扁担："陆太太，装死搬砖好玩？"她抹汗冷笑："比当替身好玩。"无人机揭晓她竟是古建泰斗，掌握长城修复秘技。当陆氏文旅项目坍塌，他跪砖窑前举钻戒："用余生赎罪，够换块砖吗？"她扬灰撒向婚戒："等长城塌了再说。"热搜爆#陆总睡烽火台唱情歌#："等城塌，或等你回头。"
62,少爷,夫人,青梅竹马,《圈宠小青梅：少爷的夫人跑路了》,傅云琛给邻家小青梅当二十年人形画板——她涂鸦他当纸，参赛他当展板，连婚戒设计都以他瞳孔为蓝本。婚礼当天她逃往巴黎，被他劫持卢浮宫："夫人忘了六岁的婚契？"他扯开西装露后背纹身——她稚嫩笔迹"傅小花归沈璃所有"。她反手投影收购案："契约更新——现在你归我私有。"当艺术频道直播时，他突然泼颜料撕画布："压轴作——逃妻囚笼。"金笼从天而降："要逃一起逃。"
63,少爷,夫人,追妻火葬场,《夫人死后，少爷她追悔莫及》,傅沉舟为救白月光逼温阮捐肾，手术台上她攥着孕检单点火自焚。三年后极地科考船破冰启航，她作为首席科学家现身甲板，傅沉舟驾直升机撞向冰川裂缝。当机身爆炸的瞬间，他用身体护住她掏出脊椎钢钉："这颗肾永远是你的。"她推开染血钢钉："傅少，过期器官该填海了。"新闻直播他沉入冰渊前嘶吼："那就用骨血暖你余生！"海洋局档案载：新发现地热泉命名"赎罪礁"，礁心嵌着钻戒刻"吾妻阮阮永生挚爱"。
64,大佬,妹妹,追妻火葬场,《流产当天，大佬的玫瑰场塌了》,封枭为救白月光逼妹妹江晚晚捐肾，手术台上接到她孕检单时已晚。三年后玫瑰坟场周年祭，她挽新欢点火焚花海："封总，葬你的白月光够用了。"他冲进火场举起骨灰盒："这里装的是我们的孩子。"烈焰吞没盒上刻字"慈父封枭立"，她突然夺过砸向墓碑："那再加座父子合葬坟！"次日头条惊爆#千亿富豪悬赏百亿求复婚#，附加条款："接受终生结扎及器官移植公证——若你需要，随时取用。"
